{
  "format": "open-values-register-snapshot",
  "version": "1.0.0",
  "snapshotId": "2026-08-14-a7fd1da18270",
  "registerId": "cfpb-complaints",
  "access": "api",
  "capturedAt": "2026-08-14T19:28:43Z",
  "request": {
    "method": "GET",
    "url": "https://www.consumerfinance.gov/data-research/consumer-complaints/search/api/v1/",
    "query": {
      "date_received_max": [
        "2025-12-31"
      ],
      "date_received_min": [
        "2024-01-01"
      ],
      "product": [
        "Credit card"
      ],
      "size": [
        "0"
      ]
    },
    "scope": "CFPB credit-card complaints received 2024-01-01 through 2025-12-31; raw complaint volume only, not normalized by company size, account count, or market share",
    "headers": {
      "Accept": "application/json, application/*+json;q=0.9, */*;q=0.1",
      "User-Agent": "ConsciousConsuming/1.0 register-snapshot"
    },
    "secretHeaderNames": []
  },
  "response": {
    "status": 200,
    "finalUrl": "https://www.consumerfinance.gov/data-research/consumer-complaints/search/api/v1/?date_received_max=2025-12-31&date_received_min=2024-01-01&product=Credit+card&size=0",
    "mediaType": "application/json",
    "bytes": 48488,
    "sha256": "8cec791a16e12fcaff2b006f74d4c307412aa38882532a9bbc213f3e21f1cf5c",
    "payload": "2026-08-14-a7fd1da18270.payload.json",
    "fetchMode": "network"
  },
  "license": {
    "url": "https://www.consumerfinance.gov/data-research/consumer-complaints/",
    "note": "Consumer Complaint Database data are released by CFPB under CC0; complaint volume requires context such as company size or market share."
  },
  "parser": {
    "id": "cfpb-complaint-aggregates-parser",
    "version": "1.0.0"
  }
}
