{
  "format": "open-values-register-snapshot",
  "version": "1.0.0",
  "snapshotId": "2026-10-13-b18ffdc19893",
  "registerId": "nhtsa",
  "access": "api",
  "capturedAt": "2026-10-13T01:37:29Z",
  "request": {
    "method": "GET",
    "url": "https://api.nhtsa.gov/SafetyRatings",
    "query": {},
    "scope": "NHTSA SafetyRatings API: every make, model and variant listed for model years 2026 and 2027, and the ratings record of each variant.",
    "headers": {
      "Accept": "application/json, application/*+json;q=0.9, */*;q=0.1",
      "User-Agent": "ConsciousConsuming/1.0 register-snapshot"
    },
    "secretHeaderNames": []
  },
  "response": {
    "status": 200,
    "finalUrl": "https://api.nhtsa.gov/SafetyRatings",
    "mediaType": "application/json",
    "bytes": 1428546,
    "sha256": "42e42bcd10483c857dc7a2e82a04ee9b47e7cac6bc495e45404ed96c50cd691d",
    "payload": "2026-10-13-b18ffdc19893.payload.json",
    "fetchMode": "file-import"
  },
  "license": {
    "url": "https://www.nhtsa.gov/about-nhtsa/terms-use",
    "note": "NHTSA terms of use: public information. The terms page was read in a browser because www.nhtsa.gov refuses scripted fetches; api.nhtsa.gov serves normally."
  },
  "parser": {
    "id": "nhtsa-safety-ratings-bundle",
    "version": "1.0.0"
  }
}
