{
  "format": "open-values-register-snapshot",
  "version": "1.0.0",
  "snapshotId": "2026-08-14-6865d17ec55e",
  "registerId": "epa-safer-choice",
  "access": "api",
  "capturedAt": "2026-08-14T19:14:35Z",
  "request": {
    "method": "GET",
    "url": "https://data.epa.gov/efservice/t_safer_choice_and_design_for_the_environment/JSON",
    "query": {},
    "scope": "Complete EPA Safer Choice and Design for the Environment product table returned by Envirofacts",
    "headers": {
      "Accept": "application/json, application/*+json;q=0.9, */*;q=0.1",
      "User-Agent": "ConsciousConsuming/1.0 register-snapshot"
    },
    "secretHeaderNames": []
  },
  "response": {
    "status": 200,
    "finalUrl": "https://data.epa.gov/efservice/t_safer_choice_and_design_for_the_environment/JSON",
    "mediaType": "application/json",
    "bytes": 2449784,
    "sha256": "e313e6e5f6357bacf2298b8d44afd191b8513ebe463d5580c00a61a55594e076",
    "payload": "2026-08-14-6865d17ec55e.payload.json",
    "fetchMode": "network"
  },
  "license": {
    "url": "https://www.epa.gov/web-policies-and-procedures/open-government-data",
    "note": "United States EPA public data; source attribution and dataset limitations retained."
  },
  "parser": {
    "id": "epa-safer-choice-parser",
    "version": "1.0.0"
  }
}
